{
  "schema_version": 1,
  "task_id": "6",
  "verdict": "PASS",
  "commit_sha": "82fb5bf43ac31c689efed6991606c31504ebf164",
  "files_modified": [
    "adapters/claude-code/doctrine/INDEX.md",
    "adapters/claude-code/manifest.json",
    "docs/failure-modes.md"
  ],
  "mechanical_checks": {
    "command:grep -q '^## FM-038 — Vaporware: decorative config control (renders but does not change behavior)' docs/failure-modes.md": {
      "passed": true,
      "detail": "",
      "command": "grep -q '^## FM-038 — Vaporware: decorative config control (renders but does not change behavior)' docs/failure-modes.md",
      "exit_code": 0
    },
    "command:grep -A20 '^## FM-038' docs/failure-modes.md | grep -q '\\*\\*Symptom\\.\\*\\*'": {
      "passed": true,
      "detail": "",
      "command": "grep -A20 '^## FM-038' docs/failure-modes.md | grep -q '\\*\\*Symptom\\.\\*\\*'",
      "exit_code": 0
    },
    "command:grep -A20 '^## FM-038' docs/failure-modes.md | grep -q '\\*\\*Discriminator\\.\\*\\*'": {
      "passed": true,
      "detail": "",
      "command": "grep -A20 '^## FM-038' docs/failure-modes.md | grep -q '\\*\\*Discriminator\\.\\*\\*'",
      "exit_code": 0
    },
    "command:grep -q '6 were decorative' docs/failure-modes.md": {
      "passed": true,
      "detail": "",
      "command": "grep -q '6 were decorative' docs/failure-modes.md",
      "exit_code": 0
    },
    "command:grep -A20 '^## FM-038' docs/failure-modes.md | grep -q 'A downstream product'": {
      "passed": true,
      "detail": "",
      "command": "grep -A20 '^## FM-038' docs/failure-modes.md | grep -q 'A downstream product'",
      "exit_code": 0
    }
  },
  "timestamp": "2026-07-13T00:13:53Z",
  "verifier": "write-evidence.sh",
  "plan_path": "docs/plans/vaporware-config-controls.md"
}
