{
  "schema_version": 1,
  "task_id": "1",
  "verdict": "PASS",
  "commit_sha": "2a7b08b5ba722f323d0377049f910d8ac86b7980",
  "files_modified": [
    "adapters/claude-code/agents/domain-expert-tester.md",
    "adapters/claude-code/agents/enforcement-gap-analyzer.md",
    "adapters/claude-code/agents/harness-reviewer.md",
    "adapters/claude-code/agents/prd-validity-reviewer.md",
    "adapters/claude-code/agents/ux-designer.md",
    "adapters/claude-code/agents/ux-end-user-tester.md"
  ],
  "mechanical_checks": {
    "exists:neural-lace/workstreams-ui/config/projects.js": {
      "passed": true,
      "detail": "neural-lace/workstreams-ui/config/projects.js exists",
      "command": "test -e neural-lace/workstreams-ui/config/projects.js",
      "exit_code": 0
    },
    "command:node --check neural-lace/workstreams-ui/config/projects.js": {
      "passed": true,
      "detail": "",
      "command": "node --check neural-lace/workstreams-ui/config/projects.js",
      "exit_code": 0
    },
    "command:node /tmp/check-task1.js": {
      "passed": true,
      "detail": "task1 checks OK: alias + resolve + traversal-reject + listDocs(21)",
      "command": "node /tmp/check-task1.js",
      "exit_code": 0
    }
  },
  "timestamp": "2026-06-11T16:39:15Z",
  "verifier": "write-evidence.sh",
  "plan_path": "docs/plans/ws-ui-modal-doc-links-2026-06-11.md"
}
