{
  "schema_version": 1,
  "task_id": "1",
  "verdict": "PASS",
  "commit_sha": "953ca59e2534017c34edf56f8550b86ce58a0e07",
  "files_modified": [
    "README.md",
    "docs/architecture-overview.md",
    "docs/reviews/2026-05-06-readme-architecture-cold-test.md"
  ],
  "mechanical_checks": {
    "exists:docs/doc-writing-patterns.md": {
      "passed": true,
      "detail": "docs/doc-writing-patterns.md exists",
      "command": "test -e docs/doc-writing-patterns.md",
      "exit_code": 0
    }
  },
  "timestamp": "2026-05-06T10:35:05Z",
  "verifier": "write-evidence.sh",
  "plan_path": "docs/plans/docs-refresh-tech-team-architecture.md"
}
