{
  "schema_version": 1,
  "task_id": "1",
  "verdict": "PASS",
  "commit_sha": "cf35399cbe675028ec4c5f7b1fab1affa8e74e68",
  "files_modified": [
    "adapters/claude-code/agents/functionality-verifier.md",
    "adapters/claude-code/agents/task-verifier.md",
    "adapters/claude-code/doctrine/INDEX.md",
    "adapters/claude-code/doctrine/planning.md",
    "adapters/claude-code/doctrine/vaporware-prevention-full.md",
    "adapters/claude-code/manifest.json",
    "docs/failure-modes.md",
    "docs/plans/vaporware-config-controls.md"
  ],
  "mechanical_checks": {
    "command:grep -qi \"decorative config control\" adapters/claude-code/doctrine/vaporware-prevention.md": {
      "passed": true,
      "detail": "",
      "command": "grep -qi \"decorative config control\" adapters/claude-code/doctrine/vaporware-prevention.md",
      "exit_code": 0
    },
    "command:grep -q \"The toggle renders and saves, so the permission works\" adapters/claude-code/doctrine/vaporware-prevention.md": {
      "passed": true,
      "detail": "",
      "command": "grep -q \"The toggle renders and saves, so the permission works\" adapters/claude-code/doctrine/vaporware-prevention.md",
      "exit_code": 0
    },
    "command:grep -q \"vaporware-prevention-full\" adapters/claude-code/doctrine/vaporware-prevention.md": {
      "passed": true,
      "detail": "",
      "command": "grep -q \"vaporware-prevention-full\" adapters/claude-code/doctrine/vaporware-prevention.md",
      "exit_code": 0
    },
    "command:test $(wc -c < adapters/claude-code/doctrine/vaporware-prevention.md) -le 3000": {
      "passed": true,
      "detail": "",
      "command": "test $(wc -c < adapters/claude-code/doctrine/vaporware-prevention.md) -le 3000",
      "exit_code": 0
    }
  },
  "timestamp": "2026-07-13T00:49:27Z",
  "verifier": "write-evidence.sh",
  "plan_path": "docs/plans/vaporware-config-controls.md"
}
