{
  "schema_version": 1,
  "task_id": "4",
  "verdict": "PASS",
  "commit_sha": "953ca59e2534017c34edf56f8550b86ce58a0e07",
  "files_modified": [
    "README.md",
    "docs/architecture-overview.md",
    "docs/reviews/2026-05-06-readme-architecture-cold-test.md"
  ],
  "mechanical_checks": {
    "command:grep -l architecture-overview docs/harness-architecture.md docs/harness-strategy.md": {
      "passed": true,
      "detail": "docs/harness-architecture.md\ndocs/harness-strategy.md",
      "command": "grep -l architecture-overview docs/harness-architecture.md docs/harness-strategy.md",
      "exit_code": 0
    }
  },
  "timestamp": "2026-05-06T10:35:06Z",
  "verifier": "write-evidence.sh",
  "plan_path": "docs/plans/docs-refresh-tech-team-architecture.md"
}
