{
  "schema_version": 1,
  "task_id": "6",
  "verdict": "PASS",
  "commit_sha": "460519e87ac352cac3e00f9ff1ef209aada0e717",
  "files_modified": [
    "adapters/claude-code/CLAUDE.md",
    "adapters/claude-code/rules/vaporware-prevention.md",
    "adapters/claude-code/scripts/analyze-propagation-audit-log.sh",
    "adapters/claude-code/skills/harness-review.md",
    "adapters/claude-code/templates/pilot-friction.md",
    "build-doctrine/CHANGELOG.md",
    "docs/best-practices.md",
    "docs/build-doctrine-roadmap.md",
    "docs/claude-code-quality-strategy.md",
    "docs/harness-architecture.md",
    "docs/harness-strategy.md"
  ],
  "mechanical_checks": {
    "files-in-commit": {
      "passed": true,
      "detail": "11 file(s) in HEAD",
      "command": "git diff-tree --no-commit-id --name-only -r HEAD",
      "exit_code": 0
    }
  },
  "timestamp": "2026-05-06T10:38:44Z",
  "verifier": "write-evidence.sh",
  "plan_path": "docs/plans/build-doctrine-5a-integration-and-audit-analyzer.md"
}
